question,answer,contexts,ground_truths,ground_truth,context_precision,context_recall,faithfulness,answer_relevancy
Pacituok lietuvių liaudies eilėraštį 'Du gaideliai',"Answer: Lietuvių liaudies eilėraštis 'Du gaideliai': ""Du gaideliai, du gaideliai baltus žirnius kūlė, dvi vištelės, dvi vištelės į malūną vežė. Ožys malė, ožys malė, ožka pikliavojo, o ši trečia ožkytėlė miltus nusijojo. Musė maišė, musė maišė, uodas vandens nešė, saulė virė, saulė virė, mėnesėlis kepė.""","['Lietuvių liaudies eilėraštis \'Du gaideliai\': ""Du gaideliai, du gaideliai baltus žirnius kūlė, dvi vištelės, dvi vištelės į malūną vežė. Ožys malė, ožys malė, ožka pikliavojo, o ši trečia ožkytėlė miltus nusijojo. Musė maišė, musė maišė, uodas vandens nešė, saulė virė, saulė virė, mėnesėlis kepė.""']","['Du gaideliai, du gaideliai baltus žirnius kūlė, dvi vištelės, dvi vištelės į malūną vežė. Ožys malė, ožys malė, ožka pikliavojo, o ši trečia ožkytėlė miltus nusijojo. Musė maišė, musė maišė, uodas vandens nešė, saulė virė, saulė virė, mėnesėlis kepė.']","Du gaideliai, du gaideliai baltus žirnius kūlė, dvi vištelės, dvi vištelės į malūną vežė. Ožys malė, ožys malė, ožka pikliavojo, o ši trečia ožkytėlė miltus nusijojo. Musė maišė, musė maišė, uodas vandens nešė, saulė virė, saulė virė, mėnesėlis kepė.",0.9999999999,1.0,1.0,0.8610881157401492
Pacituok lietuvių liaudies eilėraštį 'Trys gaideliai',Tokios informacijos nėra duomenų rinkinyje.,"['Lietuvių liaudies eilėraštis \'Du gaideliai\': ""Du gaideliai, du gaideliai baltus žirnius kūlė, dvi vištelės, dvi vištelės į malūną vežė. Ožys malė, ožys malė, ožka pikliavojo, o ši trečia ožkytėlė miltus nusijojo. Musė maišė, musė maišė, uodas vandens nešė, saulė virė, saulė virė, mėnesėlis kepė.""']",['Not enough information.'],Not enough information.,0.0,,,0.7877251262024755
Pacituok lietuvių liaudies eilėraštį 'Saule vire',Tokios informacijos nėra duomenų rinkinyje.,"['Lietuvių liaudies eilėraštis \'Du gaideliai\': ""Du gaideliai, du gaideliai baltus žirnius kūlė, dvi vištelės, dvi vištelės į malūną vežė. Ožys malė, ožys malė, ožka pikliavojo, o ši trečia ožkytėlė miltus nusijojo. Musė maišė, musė maišė, uodas vandens nešė, saulė virė, saulė virė, mėnesėlis kepė.""']",['Not enough information.'],Not enough information.,0.0,,,0.0
Kokie yra donos 'Du gaideliai' žodžiai?,"Answer: ""Du gaideliai, du gaideliai baltus žirnius kūlė, dvi vištelės, dvi vištelės į malūną vežė.""","['Lietuvių liaudies eilėraštis \'Du gaideliai\': ""Du gaideliai, du gaideliai baltus žirnius kūlė, dvi vištelės, dvi vištelės į malūną vežė. Ožys malė, ožys malė, ožka pikliavojo, o ši trečia ožkytėlė miltus nusijojo. Musė maišė, musė maišė, uodas vandens nešė, saulė virė, saulė virė, mėnesėlis kepė.""']","['Du gaideliai, du gaideliai baltus žirnius kūlė, dvi vištelės, dvi vištelės į malūną vežė. Ožys malė, ožys malė, ožka pikliavojo, o ši trečia ožkytėlė miltus nusijojo. Musė maišė, musė maišė, uodas vandens nešė, saulė virė, saulė virė, mėnesėlis kepė.']","Du gaideliai, du gaideliai baltus žirnius kūlė, dvi vištelės, dvi vištelės į malūną vežė. Ožys malė, ožys malė, ožka pikliavojo, o ši trečia ožkytėlė miltus nusijojo. Musė maišė, musė maišė, uodas vandens nešė, saulė virė, saulė virė, mėnesėlis kepė.",0.9999999999,1.0,1.0,0.8139242205635856
